<?xml version="1.0" encoding="UTF-8"?>
<sdf:sdf-file xmlns:sdf="http://www.arinc.com/arinc838"
	xmlns:xsi="http://www.w3.org/2001/XMLSchema-instance"
	xsi:schemaLocation="http://www.arinc.com/arinc838 ARINC838_Ver3.xsd ">
	<file-format-version>528384</file-format-version>
	<sdf-sections>
		<software-description>
			<software-partnumber>ACM-47-1234-5678</software-partnumber>
			<software-type-description>STD</software-type-description>
			<software-type-id>42</software-type-id>
		</software-description>
		<file-definitions>
			<file-loadable>true</file-loadable>
			<file-name>CRC_T05A.rom</file-name>
			<file-size>3976</file-size>
			<file-integrity-definition>
				<integrity-type>3</integrity-type>
				<integrity-value>0x96142DCA</integrity-value>
			</file-integrity-definition>
		</file-definitions>
		<file-definitions>
			<file-loadable>true</file-loadable>
			<file-name>CRC_T06A.rom</file-name>
			<file-size>18152</file-size>
			<file-integrity-definition>
				<integrity-type>3</integrity-type>
				<integrity-value>0xAE34897C</integrity-value>
			</file-integrity-definition>
		</file-definitions>
		<thw-definition>
			<thw-id>ID3</thw-id>
			<thw-position>R</thw-position>
			<thw-position>L</thw-position>
		</thw-definition>
		<sdf-integrity-definition>
			<integrity-type>3</integrity-type>
			<integrity-value>0x00000000</integrity-value>
		</sdf-integrity-definition>
		<lsp-integrity-definition>
			<integrity-type>3</integrity-type>
			<integrity-value>0x00000000</integrity-value>
		</lsp-integrity-definition>
	</sdf-sections>
</sdf:sdf-file>
